{
  "contract": "spike/ecad-mcad-geometry/v1",
  "schema_version": 1,
  "units": "mm",
  "coordinate_system": {
    "handedness": "right",
    "up_axis": "Z",
    "origin": [0.0, 0.0, 0.0]
  },
  "design": {
    "id": "example-board",
    "name": "SPIKE Exchange Example",
    "revision": "A"
  },
  "generator": {
    "name": "SPIKE",
    "version": "example"
  },
  "metadata": {
    "purpose": "FreeCAD workbench smoke test"
  },
  "objects": [
    {
      "id": "board/main",
      "name": "Board outline",
      "role": "board",
      "primitive": {
        "type": "polygon_prism",
        "points": [[0.0, 0.0], [80.0, 0.0], [80.0, 50.0], [0.0, 50.0]],
        "z": 0.0,
        "height": 1.6
      },
      "visual": {
        "color": [0.18, 0.45, 0.29],
        "opacity": 1.0
      }
    },
    {
      "id": "component/U1/envelope",
      "name": "U1 component envelope",
      "role": "component_envelope",
      "primitive": {
        "type": "box",
        "origin": [26.0, 16.0, 1.6],
        "size": [18.0, 18.0, 4.5]
      },
      "metadata": {
        "reference": "U1"
      }
    },
    {
      "id": "keepout/top-center",
      "name": "Top-center keepout",
      "role": "keepout",
      "primitive": {
        "type": "box",
        "origin": [20.0, 10.0, 1.6],
        "size": [30.0, 30.0, 12.0]
      },
      "visual": {
        "color": [0.9, 0.25, 0.22],
        "opacity": 0.35
      }
    },
    {
      "id": "mounting-hole/H1",
      "name": "H1 reference volume",
      "role": "mounting_hole",
      "primitive": {
        "type": "cylinder",
        "center": [6.0, 6.0, 0.0],
        "radius": 1.6,
        "height": 1.6,
        "axis": [0.0, 0.0, 1.0]
      }
    }
  ]
}

